<?xml version="1.0" encoding="UTF-8"?>
<!DOCTYPE tellico PUBLIC '-//Robby Stephenson/DTD Tellico V11.0//EN' 'http://periapsis.org/tellico/dtd/v11/tellico.dtd'>
<tellico xmlns="http://periapsis.org/tellico/" syntaxVersion="11">
 <collection title="No CDate Music" type="4">
  <fields>
   <field name="_default"/>
  </fields>
  <entry id="2">
   <title>CDate Test</title>
   <!-- SpaceX Crew Dragon Demo-2 launch date -->
   <mdate calendar="gregorian">
    <year>2020</year>
    <month>05</month>
    <day>30</day>
   </mdate>
  </entry>
 </collection>
</tellico>
